<?xml version='1.0'?>
<!DOCTYPE platform SYSTEM "https://simgrid.org/simgrid.dtd">
<platform version="4.1">
  <zone  id="AS0"  routing="Full">
    <host id="Jupiter"  speed="25Mf" speed_file="profiles/jupiter_speed.profile" />
    <host id="Fafard"   speed="25Mf"/>

    <link id="1" bandwidth="1MBps" latency="10ms" bandwidth_file="profiles/link1_bandwidth.profile" latency_file="profiles/link1_latency.profile" />
    <link id="2" bandwidth="1MBps" latency="10ms"/>

    <route src="Fafard" dst="Jupiter" symmetrical="NO">
      <link_ctn id="1"/>
    </route>
    <route src="Jupiter" dst="Fafard" symmetrical="NO">
      <link_ctn id="2"/>
    </route>
  </zone>
</platform>
