<?xml version='1.0'?>
<!DOCTYPE platform SYSTEM "http://simgrid.gforge.inria.fr/simgrid/simgrid.dtd">
<platform version="4">
  <!-- The master process (with some arguments) -->
  <process host="Ginette" function="execute">
     <argument value="Tremblay"/>
     <argument value="Jupiter"/>
     <argument value="Fafard"/> 
     <argument value="Ginette"/>
     <argument value="4e9"/>
     <argument value="16e4"/>
  </process>
  <process host="Ginette" function="redistribute">
    <argument value="Tremblay"/>
    <argument value="Jupiter"/>
    <argument value="Fafard"/> 
    <argument value="Ginette"/>
    <argument value="16e8"/>
  </process>
</platform>
