<?xml version='1.0'?>
<!DOCTYPE platform SYSTEM "http://simgrid.gforge.inria.fr/simgrid/simgrid.dtd">
<platform version="4">
  <!-- For using with chainsend -->
  <!-- Broadcaster -->
  <process host="node-0.acme.org" function="broadcaster">
    <argument value="8"/> <!-- number of peers -->
    <argument value="256"/> <!-- number of pieces -->
  </process>

  <!-- Peers -->
  <process host="node-1.acme.org" function="peer">
    <argument value="1"/>  </process>
  <process host="node-2.acme.org" function="peer">
    <argument value="2"/>
  </process>
  <process host="node-3.acme.org" function="peer">
    <argument value="3"/>
  </process>
  <process host="node-4.acme.org" function="peer">
    <argument value="4"/>
  </process>
  <process host="node-5.acme.org" function="peer">
    <argument value="5"/>
  </process>
  <process host="node-6.acme.org" function="peer">
    <argument value="6"/>
  </process>
  <process host="node-7.acme.org" function="peer">
    <argument value="7"/>
  </process>
  <process host="node-8.acme.org" function="peer">
    <argument value="8"/>
  </process>
</platform>
