<?xml version='1.0'?>
<!DOCTYPE platform SYSTEM "http://simgrid.gforge.inria.fr/simgrid.dtd">
<platform version="3">
  <!-- The master process (with some arguments) -->

  <process host="Jacquelin" function="basic.Master">
     <argument value="10"/>       <!-- Number of tasks -->
     <argument value="50000000"/>  <!-- Computation size of tasks -->
     <argument value="1000000"/>   <!-- Communication size of tasks -->
     <argument value="2"/>  <!-- Number of slaves -->
  </process>
  <!-- The slave process (with no argument) -->
  <process host="Jacquelin" function="basic.Slave"><argument value="0"/></process>
  <process host="Boivin" function="basic.Slave" start_time="5"><argument value="1"/></process>
<!--  <process host="Jean_Yves" function="Slave"><argument value="2"/></process>
  <process host="TeX" function="Slave"><argument value="3"/></process>
  <process host="Geoff" function="Slave"><argument value="4"/></process>
  <process host="Disney" function="Slave"><argument value="5"/></process>
  <process host="iRMX" function="Slave"><argument value="6"/></process>
  <process host="McGee" function="Slave"><argument value="7"/></process>
  <process host="Gatien" function="Slave"><argument value="8"/></process>
  <process host="Laroche" function="Slave"><argument value="9"/></process>
  <process host="Tanguay" function="Slave"><argument value="10"/></process>
  <process host="Morin" function="Slave"><argument value="11"/></process>
  <process host="Ethernet" function="Slave"><argument value="12"/></process>
  <process host="Bellemarre" function="Slave"><argument value="13"/></process>
  <process host="Kuenning" function="Slave"><argument value="14"/></process>
  <process host="Gaston" function="Slave"><argument value="15"/></process>
  <process host="Harry" function="Slave"><argument value="16"/></process>
  <process host="Bousquet" function="Slave"><argument value="17"/></process>
  <process host="Paul" function="Slave"><argument value="18"/></process>
  <process host="St_Jean" function="Slave"><argument value="19"/></process>
  <process host="Jill" function="Slave"><argument value="20"/></process>
  <process host="Marcel" function="Slave"><argument value="21"/></process>
  <process host="Wright" function="Slave"><argument value="22"/></process>
  <process host="Jackson" function="Slave"><argument value="23"/></process>
  <process host="Fernand" function="Slave"><argument value="24"/></process>
  <process host="Soucy" function="Slave"><argument value="25"/></process>
  <process host="Ste_Julie" function="Slave"><argument value="26"/></process>
  <process host="Victoria" function="Slave"><argument value="27"/></process>
  <process host="Lessard" function="Slave"><argument value="28"/></process>
  <process host="Florient" function="Slave"><argument value="29"/></process>
  <process host="Marcoux" function="Slave"><argument value="30"/></process>
  <process host="Gavrel" function="Slave"><argument value="31"/></process>
  <process host="Bescherelle" function="Slave"><argument value="32"/></process>
  <process host="Pierre" function="Slave"><argument value="33"/></process>
  <process host="Jamie" function="Slave"><argument value="34"/></process>
  <process host="Rubin" function="Slave"><argument value="35"/></process>
  <process host="Olivier" function="Slave"><argument value="36"/></process>
  <process host="Boucherville" function="Slave"><argument value="37"/></process>
  <process host="Pointe_Claire" function="Slave"><argument value="38"/></process>
  <process host="Kansas" function="Slave"><argument value="39"/></process>
  <process host="King" function="Slave"><argument value="40"/></process>
  <process host="Lapointe" function="Slave"><argument value="41"/></process>
  <process host="Julian" function="Slave"><argument value="42"/></process>
  <process host="Lafontaine" function="Slave"><argument value="43"/></process>
  <process host="Gordon" function="Slave"><argument value="44"/></process>
  <process host="Drouin" function="Slave"><argument value="45"/></process>
  <process host="Robert" function="Slave"><argument value="46"/></process>
  <process host="Jocelyne" function="Slave"><argument value="47"/></process>
  <process host="Stephen" function="Slave"><argument value="48"/></process>
  <process host="Provost" function="Slave"><argument value="49"/></process>
  <process host="Juneau" function="Slave"><argument value="50"/></process>
  <process host="Casavant" function="Slave"><argument value="51"/></process>
  <process host="St_Antoine" function="Slave"><argument value="52"/></process>
  <process host="Louis" function="Slave"><argument value="53"/></process>
  <process host="Julien" function="Slave"><argument value="54"/></process>
  <process host="St_Paul" function="Slave"><argument value="55"/></process>
  <process host="Mathematica" function="Slave"><argument value="56"/></process>
  <process host="LaTeX" function="Slave"><argument value="57"/></process>
  <process host="Sirois" function="Slave"><argument value="58"/></process>
  <process host="Monique" function="Slave"><argument value="59"/></process>
  <process host="Audy" function="Slave"><argument value="60"/></process>
  <process host="Bourassa" function="Slave"><argument value="61"/></process>
  <process host="OHara" function="Slave"><argument value="62"/></process>
  <process host="Boston" function="Slave"><argument value="63"/></process>
  <process host="Papineau" function="Slave"><argument value="64"/></process>
  <process host="Fraser" function="Slave"><argument value="65"/></process>
  <process host="Browne" function="Slave"><argument value="66"/></process>
  <process host="SunOS" function="Slave"><argument value="67"/></process>
  <process host="Varennes" function="Slave"><argument value="68"/></process>
  <process host="Jacques" function="Slave"><argument value="69"/></process>
  <process host="Thierry" function="Slave"><argument value="70"/></process>
  <process host="Lachapelle" function="Slave"><argument value="71"/></process>
  <process host="kV" function="Slave"><argument value="72"/></process>
  <process host="Yolande" function="Slave"><argument value="73"/></process>
  <process host="Pronovost" function="Slave"><argument value="74"/></process>
  <process host="SPICE" function="Slave"><argument value="75"/></process>
  <process host="Europe" function="Slave"><argument value="76"/></process>
  <process host="Roy" function="Slave"><argument value="77"/></process>
  <process host="Amadeus" function="Slave"><argument value="78"/></process>
  <process host="Intel" function="Slave"><argument value="79"/></process>
  <process host="Cambridge" function="Slave"><argument value="80"/></process>
  <process host="Tremblay" function="Slave"><argument value="81"/></process>
  <process host="UNIX" function="Slave"><argument value="82"/></process>
  <process host="Domey" function="Slave"><argument value="83"/></process>
  <process host="St_Bruno" function="Slave"><argument value="84"/></process>
  <process host="Jean_Claude" function="Slave"><argument value="85"/></process>
  <process host="Doyon" function="Slave"><argument value="86"/></process>
  <process host="Fafard" function="Slave"><argument value="87"/></process>
  <process host="Croteau" function="Slave"><argument value="88"/></process>
  <process host="Dodge" function="Slave"><argument value="89"/></process>
  <process host="Jacquelin" function="Slave"><argument value="90"/></process>
  <process host="Boivin" function="Slave"><argument value="91"/></process>
  <process host="Jean_Yves" function="Slave"><argument value="92"/></process>
  <process host="TeX" function="Slave"><argument value="93"/></process>
  <process host="Geoff" function="Slave"><argument value="94"/></process>
  <process host="Disney" function="Slave"><argument value="95"/></process>
  <process host="iRMX" function="Slave"><argument value="96"/></process>
  <process host="McGee" function="Slave"><argument value="97"/></process>
  <process host="Gatien" function="Slave"><argument value="98"/></process>
  <process host="Laroche" function="Slave"><argument value="99"/></process>
  <process host="Tanguay" function="Slave"><argument value="100"/></process> -->
</platform>
