<?xml version='1.0'?>
 <!DOCTYPE platform SYSTEM "http://simgrid.gforge.inria.fr/simgrid.dtd">
 <platform version="3">
 <AS  id="AS0"  routing="Full">
   <!-- ljlkj -->
   <host id="Inmos" power="98.095mf"/>
   <host id="Bellevue" power="76.296mf"/>
   <host id="Fafard" power="76.296mf"/>
   <host id="Ginette" power="48.492mf"/>
   <host id="Bourassa" power="48.492mf"/>
   <link id="6" bandwidth="41.279125MBps" latency="59.904us"/>
   <link id="11" bandwidth="252.75KBps" latency="5.70455ms"/>
   <link id="3" bandwidth="34.285625MBps" latency="514.433us"/>
   <link id="7" bandwidth="11.618875MBps" latency="189.98us"/>
   <link id="9" bandwidth="7.20975MBps" latency="1.461517ms"/>
   <link id="12" bandwidth="1.792625MBps" latency="7.877863ms"/>
   <link id="2" bandwidth="118.6825MBps" latency="136.931us"/>
   <link id="8" bandwidth="8.158MBps" latency="270.544us"/>
   <link id="1" bandwidth="34.285625MBps" latency="514.433us"/>
   <link id="4" bandwidth="10.099625MBps" latency="479.78us"/>
   <link id="0" bandwidth="41.279125MBps" latency="59.904us"/>
   <link id="10" bandwidth="4.67975MBps" latency="848.712us"/>
   <link id="5" bandwidth="27.94625MBps" latency="278.066us"/>
   <link id="loopback_FATPIPE" bandwidth="10MBps" latency="100ms" sharing_policy="FATPIPE"/>
   <link id="loopback" bandwidth="498MBps" latency="15us"/>
   <route src="Inmos" dst="Inmos"><link_ctn id="loopback"/></route>
   <route src="Bellevue" dst="Bellevue"><link_ctn id="loopback"/></route>
   <route src="Fafard" dst="Fafard"><link_ctn id="loopback"/></route>
   <route src="Ginette" dst="Ginette"><link_ctn id="loopback"/></route>
   <route src="Bourassa" dst="Bourassa"><link_ctn id="loopback"/></route>
   <route src="Inmos" dst="Bellevue">
     <link_ctn id="9"/>
   </route>
   <route src="Inmos" dst="Fafard">
     <link_ctn id="4"/><link_ctn id="3"/><link_ctn id="2"/><link_ctn id="0"/><link_ctn id="1"/><link_ctn id="8"/>
   </route>
   <route src="Inmos" dst="Ginette">
     <link_ctn id="4"/><link_ctn id="3"/><link_ctn id="5"/>
   </route>
   <route src="Inmos" dst="Bourassa">
     <link_ctn id="4"/><link_ctn id="3"/><link_ctn id="2"/><link_ctn id="0"/><link_ctn id="1"/><link_ctn id="6"/><link_ctn id="7"/>
   </route>
   <route src="Bellevue" dst="Fafard">
     <link_ctn id="9"/><link_ctn id="4"/><link_ctn id="3"/><link_ctn id="2"/><link_ctn id="0"/><link_ctn id="1"/><link_ctn id="8"/>
   </route>
   <route src="Bellevue" dst="Ginette">
     <link_ctn id="9"/><link_ctn id="4"/><link_ctn id="3"/><link_ctn id="5"/>
   </route>
   <route src="Bellevue" dst="Bourassa">
     <link_ctn id="9"/><link_ctn id="4"/><link_ctn id="3"/><link_ctn id="2"/><link_ctn id="0"/><link_ctn id="1"/><link_ctn id="6"/><link_ctn id="7"/>
   </route>
   <route src="Fafard" dst="Ginette">
     <link_ctn id="8"/><link_ctn id="1"/><link_ctn id="0"/><link_ctn id="2"/><link_ctn id="5"/>
   </route>
   <route src="Fafard" dst="Bourassa">
     <link_ctn id="8"/><link_ctn id="6"/><link_ctn id="7"/>
   </route>
   <route src="Ginette" dst="Bourassa">
     <link_ctn id="5"/><link_ctn id="2"/><link_ctn id="0"/><link_ctn id="1"/><link_ctn id="6"/><link_ctn id="7"/>
   </route>
 </AS>
 </platform>
