<?xml version='1.0'?>
<!DOCTYPE platform SYSTEM "http://simgrid.gforge.inria.fr/simgrid/simgrid.dtd">
<platform version="4">
  <process host="Jacquelin" function="kademlia.Node">
    <argument value="0"/>        <!-- my id -->
    <argument value ="900"/>     <!-- deadline -->
  </process>
  <process host="Boivin" function="kademlia.Node">
    <argument value="1"/>        <!-- my id -->
    <argument value="0"/>        <!-- known id -->
    <argument value ="900"/>     <!-- deadline -->
  </process>
  <process host="Jean_Yves" function="kademlia.Node">
    <argument value="2"/>        <!-- my id -->
    <argument value="0"/>        <!-- known id -->
    <argument value ="900"/>     <!-- deadline -->
  </process>
  <process host="TeX" function="kademlia.Node">
    <argument value="4"/>        <!-- my id -->
    <argument value="0"/>        <!-- known id -->
    <argument value ="900"/>     <!-- deadline -->  
  </process>
</platform>
