<?xml version='1.0'?>
 <!DOCTYPE platform SYSTEM "http://simgrid.gforge.inria.fr/simgrid.dtd">
 <platform version="3">
 <AS  id="AS0"  routing="Full">
   <host id="bob" power="1000000000"/>
   <host id="alice" power="500000000"/>
 
   <link id="link_bob" bandwidth="125000000" latency="5E-5"/>
   <link id="link_alice" bandwidth="125000000" latency="5E-5"/>
   <link id="switch" bandwidth="125000000" latency="5E-5"
         sharing_policy="FATPIPE"/>
 
   <route src="bob" dst="alice">
     <link_ctn id="link_bob"/>
     <link_ctn id="switch"/>
     <link_ctn id="link_alice"/>
   </route>
 </AS>
 </platform>
