<?xml version='1.0'?>
<!DOCTYPE platform SYSTEM "https://simgrid.org/simgrid.dtd">
<platform version="4.1">
  <zone id="AS0" routing="Full">
    <host id="bob" speed="1Gf">
      <disk id="Disk1" read_bw="100MBps" write_bw="40MBps">
        <prop id="size" value="500GiB"/>
        <prop id="mount" value="/scratch"/>
        <prop id="content" value="storage/content/storage_content.txt"/>
      </disk>
      <disk id="Disk2" read_bw="200MBps" write_bw="80MBps"/>
    </host>

    <host id="alice" speed="1Gf">
      <disk id="Disk1" read_bw="200MBps" write_bw="80MBps">
        <prop id="content" value="storage/content/small_content.txt"/>
      </disk>
    </host>

    <host id="carl" speed="1Gf">
      <prop id="remote_disk" value="/scratch:Disk1:bob"/>
    </host>

    <link id="link1" bandwidth="125MBps" latency="150us" />
    <link id="link2" bandwidth="125MBps" latency="150us" />
    <link id="link3" bandwidth="125MBps" latency="150us" />

    <route src="bob" dst="alice">
      <link_ctn id="link1" />
    </route>
    <route src="bob" dst="carl">
      <link_ctn id="link2" />
    </route>
    <route src="alice" dst="carl">
      <link_ctn id="link3" />
    </route>
  </zone>
</platform>
