<?xml version='1.0'?>
<!DOCTYPE platform SYSTEM "http://simgrid.gforge.inria.fr/simgrid.dtd">
<platform version="3">
	
<config id="General">
	<prop id="maxmin/precision" value="0.000010"></prop>
	<prop id="cpu/optim" value="TI"></prop>
	<prop id="workstation/model" value="compound"></prop>
	<prop id="network/model" value="Vegas"></prop>
	<prop id="path" value="~/"></prop>
</config>
	
<AS  id="AS0"  routing="Full">
	<host id="bob" power="500mf"/>
</AS>
</platform>
