<?xml version='1.0'?>
<!DOCTYPE platform SYSTEM "simgrid.dtd">
<platform version="2">
  <!-- The master process (with some arguments) -->
  <process host="Tremblay" function="sender">
     <argument value="3"/>       <!-- Number of tasks -->
     <argument value="50000000"/>  <!-- Computation size of tasks -->
     <argument value="1000000"/>   <!-- Communication size of tasks -->
     <argument value="1"/>         <!-- Number of receivers -->
     <argument value="5"/>         <!-- Sleep_start_time -->
     <argument value="0.1"/>      <!-- Time for test -->
  </process>
  <!-- The receiver processes -->
  <process host="Ruby" function="receiver">
    <argument value="0"/>
    <argument value="1"/>         <!-- Sleep_start_time -->
    <argument value="0.1"/>      <!-- Time for test -->
  </process>
</platform>
