<?xml version='1.0'?>
 <!DOCTYPE platform SYSTEM "simgrid.dtd">
 <platform version="2">
 <AS  id="AS0"  routing="Full">
   <!-- ljlkj -->
   <host id="Tremblay" power="98095000"/>
   <host id="Jupiter" power="76296000"/>
   <host id="Fafard" power="76296000"/>
   <host id="Ginette" power="48492000"/>
   <host id="Bourassa" power="48492000"/>
   <link id="6" bandwidth="41279125" latency="5.9904e-05"/>
   <link id="11" bandwidth="252750" latency="0.00570455"/>
   <link id="3" bandwidth="34285625" latency="0.000514433"/>
   <link id="7" bandwidth="11618875" latency="0.00018998"/>
   <link id="9" bandwidth="7209750" latency="0.001461517"/>
   <link id="12" bandwidth="1792625" latency="0.007877863"/>
   <link id="2" bandwidth="118682500" latency="0.000136931"/>
   <link id="8" bandwidth="8158000" latency="0.000270544"/>
   <link id="1" bandwidth="34285625" latency="0.000514433"/>
   <link id="4" bandwidth="10099625" latency="0.00047978"/>
   <link id="0" bandwidth="41279125" latency="5.9904e-05"/>
   <link id="10" bandwidth="4679750" latency="0.000848712"/>
   <link id="5" bandwidth="27946250" latency="0.000278066"/>
   <link id="loopback" bandwidth="498000000" latency="0.000015" sharing_policy="FATPIPE"/>
   <route src="Tremblay" dst="Tremblay"><link_ctn id="loopback"/></route>
   <route src="Jupiter" dst="Jupiter"><link_ctn id="loopback"/></route>
   <route src="Fafard" dst="Fafard"><link_ctn id="loopback"/></route>
   <route src="Ginette" dst="Ginette"><link_ctn id="loopback"/></route>
   <route src="Bourassa" dst="Bourassa"><link_ctn id="loopback"/></route>
   <route src="Tremblay" dst="Jupiter">
     <link_ctn id="9"/>
   </route>
   <route src="Tremblay" dst="Fafard">
     <link_ctn id="4"/><link_ctn id="3"/><link_ctn id="2"/><link_ctn id="0"/><link_ctn id="1"/><link_ctn id="8"/>
   </route>
   <route src="Tremblay" dst="Ginette">
     <link_ctn id="4"/><link_ctn id="3"/><link_ctn id="5"/>
   </route>
   <route src="Tremblay" dst="Bourassa">
     <link_ctn id="4"/><link_ctn id="3"/><link_ctn id="2"/><link_ctn id="0"/><link_ctn id="1"/><link_ctn id="6"/><link_ctn id="7"/>
   </route>
   <route src="Jupiter" dst="Tremblay">
     <link_ctn id="9"/>
   </route>
   <route src="Jupiter" dst="Fafard">
     <link_ctn id="9"/><link_ctn id="4"/><link_ctn id="3"/><link_ctn id="2"/><link_ctn id="0"/><link_ctn id="1"/><link_ctn id="8"/>
   </route>
   <route src="Jupiter" dst="Ginette">
     <link_ctn id="9"/><link_ctn id="4"/><link_ctn id="3"/><link_ctn id="5"/>
   </route>
   <route src="Jupiter" dst="Bourassa">
     <link_ctn id="9"/><link_ctn id="4"/><link_ctn id="3"/><link_ctn id="2"/><link_ctn id="0"/><link_ctn id="1"/><link_ctn id="6"/><link_ctn id="7"/>
   </route>
   <route src="Fafard" dst="Tremblay">
     <link_ctn id="8"/><link_ctn id="1"/><link_ctn id="0"/><link_ctn id="2"/><link_ctn id="3"/><link_ctn id="4"/>
   </route>
   <route src="Fafard" dst="Jupiter">
     <link_ctn id="8"/><link_ctn id="1"/><link_ctn id="0"/><link_ctn id="2"/><link_ctn id="3"/><link_ctn id="4"/><link_ctn id="9"/>
   </route>
   <route src="Fafard" dst="Ginette">
     <link_ctn id="8"/><link_ctn id="1"/><link_ctn id="0"/><link_ctn id="2"/><link_ctn id="5"/>
   </route>
   <route src="Fafard" dst="Bourassa">
     <link_ctn id="8"/><link_ctn id="6"/><link_ctn id="7"/>
   </route>
   <route src="Ginette" dst="Tremblay">
     <link_ctn id="5"/><link_ctn id="3"/><link_ctn id="4"/>
   </route>
   <route src="Ginette" dst="Jupiter">
     <link_ctn id="5"/><link_ctn id="3"/><link_ctn id="4"/><link_ctn id="9"/>
   </route>
   <route src="Ginette" dst="Fafard">
     <link_ctn id="5"/><link_ctn id="2"/><link_ctn id="0"/><link_ctn id="1"/><link_ctn id="8"/>
   </route>
   <route src="Ginette" dst="Bourassa">
     <link_ctn id="5"/><link_ctn id="2"/><link_ctn id="0"/><link_ctn id="1"/><link_ctn id="6"/><link_ctn id="7"/>
   </route>
   <route src="Bourassa" dst="Tremblay">
     <link_ctn id="7"/><link_ctn id="6"/><link_ctn id="1"/><link_ctn id="0"/><link_ctn id="2"/><link_ctn id="3"/><link_ctn id="4"/>
   </route>
   <route src="Bourassa" dst="Jupiter">
     <link_ctn id="7"/><link_ctn id="6"/><link_ctn id="1"/><link_ctn id="0"/><link_ctn id="2"/><link_ctn id="3"/><link_ctn id="4"/><link_ctn id="9"/>
   </route>
   <route src="Bourassa" dst="Fafard">
     <link_ctn id="7"/><link_ctn id="6"/><link_ctn id="8"/>
   </route>
   <route src="Bourassa" dst="Ginette">
     <link_ctn id="7"/><link_ctn id="6"/><link_ctn id="1"/><link_ctn id="0"/><link_ctn id="2"/><link_ctn id="5"/>
   </route>
 </AS>
 </platform>
