<?xml version='1.0'?>
<!DOCTYPE platform SYSTEM "http://simgrid.gforge.inria.fr/simgrid.dtd">
<platform version="3">

  <process host="Gatien" function="node">
    <argument value="48"/>        <!-- my id -->
    <argument value="1"/>         <!-- known id -->
    <argument value="4"/>        <!-- time to sleep before it starts-->
    <argument value ="60"/>		<!-- deadline -->
  </process>

  <process host="McGee" function="node">
    <argument value="42"/>        <!-- my id -->
    <argument value="1"/>         <!-- known id -->
    <argument value="3"/>        <!-- time to sleep before it starts-->
    <argument value ="60"/>		<!-- deadline -->
  </process>

  <process host="Geoff" function="node">
    <argument value="32"/>        <!-- my id -->
    <argument value="1"/>         <!-- known id -->
    <argument value="10"/>         <!-- time to sleep before it starts-->
    <argument value ="60"/>            <!-- deadline -->
  </process>
  
   <process host="Jacquelin" function="node">
    <argument value="1"/>         <!-- my id -->
    <argument value ="60"/>             <!-- deadline -->
   </process>

</platform>
